{
  "coords": "outside",
  "font": {
    "family": "display",
    "size": "0.15in",
    "weight": "bold"
  },
  "cutlines": 25,
  "cutlinesOffset": 0,
  "bleed": 12.5,
  "margin": 25,
  "paper": {
    "width": 850,
    "height": 1100,
    "margins": 25
  },
  "currency": {
    "bank": true,
    "border": true,
    "capital": true,
    "market": false,
    "offboard": false,
    "par": false,
    "private": true,
    "revenue": false,
    "share": true,
    "terrain": true,
    "token": true,
    "train": true,
    "treasury": true,
    "value": false
  },
  "companySvgLogos": "main",
  "overrideCompanies": "none",
  "overrideSelection": [],
  "maps": {
    "players": true,
    "roundTracker": true,
    "market": true
  },
  "plainMapCompanies": false,
  "tileCompanies": true,
  "straightCityNames": false,
  "theme": "gmt",
  "companiesTheme": "rob",
  "export": {
    "allLayouts": false
  },
  "charters": {
    "style": "color",
    "layout": "free",
    "cutlines": 25,
    "bleed": 12.5,
    "halfWidth": false,
    "halfWidthMinors": false,
    "smallerMinors": true,
    "border": 0,
    "blackBand": false,
    "showPhaseChart": true,
    "showTurnOrder": true,
    "showMinorTurnOrder": false,
    "trainCards": "charter",
    "trainCardBorder": true,
    "trainCardRound": true,
    "pins": {
      "innerRadius": 6.25,
      "outerRadius": 12.5,
      "y": 25,
      "x1": 75,
      "x2": 675
    }
  },
  "cards": {
    "shareStyle": "gmt",
    "layout": "miniEuroDie",
    "width": 265.748,
    "height": 173.228,
    "cutlines": 25,
    "bleed": 12.5,
    "dtgPadding": 0,
    "padding": 12.5,
    "border": 0,
    "blackBand": false,
    "showPins": false,
    "pins": {
      "innerRadius": 6.25,
      "outerRadius": 12.5,
      "y": 25,
      "x1": 100,
      "x2": 700
    }
  },
  "tokens": {
    "layout": "free",
    "marketTokenSize": 50,
    "stationTokenSize": 37.5,
    "generalTokenSize": 50,
    "bleed": true,
    "reverseMarketTokens": "all"
  },
  "privates": {
    "style": "small"
  },
  "trains": {
    "style": "color",
    "images": false
  },
  "tiles": {
    "id": "right",
    "colorblind": false,
    "layout": "die",
    "width": 150,
    "mapWidth": 150,
    "gaps": true,
    "cutBorder": false,
    "showPins": false,
    "pins": {
      "innerRadius": 6.25,
      "outerRadius": 12.5,
      "y": 25,
      "x1": 100,
      "x2": 700
    }
  },
  "stock": {
    "cell": {
      "width": 70,
      "height": 85
    },
    "value": "top",
    "arrows": "bottom",
    "column": 4,
    "diag": 2,
    "par": 4,
    "display": {
      "legend": true,
      "par": true,
      "roundTracker": true
    }
  }
}
